user_name,score,content,clean_content,sentimen
Fariz Maulana,1,"giliran mau hapus akun loadingnya lama bgt,tolong dong saya udah ga pake akun dana nya takut di salah gunakan makanya saya hapus,tolong di bantu",gilir hapus akun loadingnya banget tolong udah pake akun dana nya takut salah hapus tolong bantu,netral
Misnanti Misnanti,1,2 kali uang saya hilang 1 menit aja,kali uang hilang menit aja,netral
Anggi Eka Aldina,1,Lagi dan lagi uang ku hilang 50.000 padahal saya tidak mempunyai tagihan apps,uang ku hilang tagih apps,netral
Sindy Laila,1,"GA JELAS BANGET SEKARANG DANA, KENA BIAYA TIAP TOPUP KITA KEPOTONG, JADI IKUT IKUTAN OVO",banget dana kena biaya topup potong ikut ovo,netral
Prayitno Rayit,1,knapa saat ini aplikasi dan aku bermasalah,knapa aplikasi masalah,netral
Jep Rizal,1,dna gua kok kalo mau ngirim pakek qirs berterusan gambar kurang jelas,dna gua kalo ngirim pakek qirs terus gambar,netral
Faa Bcin,1,aplikasi busuk,aplikasi busuk,netral
Muhammad Rizky Iky,1,mau ganti no aja kode nya ga di kirim²,ganti no aja kode nya kirim,netral
Klaten Jawa,1,kenapa dana aplikasi sy gk ada yg dana cicilnya padahal hampir tiap hari sy menggunakan aplikasi dana,dana aplikasi sy dana cicil sy aplikasi dana,netral
Mauliani 93,1,halo mimin kenapa untuk pilihan propinsinya malah gak ada untuk kota makassar buruk sekali,halo mimin pilih propinsi kota makassar buruk,negatif
Ramdani Dani,1,bagus sih cuman aneh nya dana cicil gak bisa ada maap,bagus sih cuman aneh nya dana cicil maap,positif
Nonoya,1,"dana, kok setiap gw main tangkap sampah buat dapat 6jt perbulan crash Mulu sih heran gw curiga kalian yg sengaja ngecrash sendiri, karena peringatan di hp gw mendeteksi ini apk crash karena alasan nya sendiri, kocak bgt betulin kalo ga mau dapat rating jelek",dana gw main tangkap sampah jt bulan crash mulu sih heran gw curiga sengaja ngecrash ingat hp gw deteksi apk crash alas nya kocak banget betulin kalo rating jelek,negatif
Ary Conver,1,dana cicilan saya sudah 2 bulan tidak bisa juga digunakan limit ada tagihan saya tidak ada,dana cicil limit tagih,netral
Ukhlis,1,gk jelas masa dana bisa di hek orang kan tolol,dana hek orang tolol,netral
MUHAMMAD ZIDNI,1,ini kenapa tiba tiba update banyak fitur gak jelas contoh nya dana goals yang tadinya gak ada verivikasih wajah tiba tiba ada verivikasih wajah,update fitur contoh nya dana goals verivikasih wajah verivikasih wajah,netral
Indah Fujiama,1,"saya mau lepas KTP lama bangetttt, akun dana yang dulu mau saya buat tidak premium lagi tapiii kenapa di persulit sih😭😭",lepas ktp bangetttt akun dana premium tapiii sulit sih,netral
Supirman Jaya,1,"layanan sangat jelek, saya ingin top up dana melalui bca, tpi saldo dana suda limit, top up berhasil tpi saldo terpotong trus ga masuk saldonya sampe skrng suda di tunggu ga masuk"" hilng gitu aja, di cek ulang ke bank terkait ttp ga balek saldonya! ketipu jg ak, diana banyak cakap tpi ga bisa bantu",layan jelek top up dana bca tpi saldo dana suda limit top up hasil tpi saldo potong trus masuk saldo sampe skrng suda tunggu masuk hilng gitu aja cek ulang bank kait ttp balek saldo tipu jg ak ana cakap tpi bantu,netral
Dani andika Laksamana putra,1,saldo nya selalu ilang tolong jangan download aplikasi ini aplikasi sampah,saldo nya ilang tolong download aplikasi aplikasi sampah,netral
Agus Semprong,1,"saldo tiba tiba hilang tanpa pengetahuan, dan sudah meminta pengembalian dana tapi tidak bisa",saldo hilang tahu kembali dana,netral
KHOIRUR RHOZIQIN,1,"saat transfer, saldo yg berkurang melebihi saldo yg keluar.. transfer 200k saldo yg terpotong 300k.. dan saldo sering hilang entah kemana tidak terlacak di history transaksi",transfer saldo kurang lebih saldo transfer k saldo potong k saldo hilang mana lacak history transaksi,netral
Maulana yusuf,1,bisa ya dana otp dimasukin penipu apk busuk,ya dana otp dimasukin tipu apk busuk,negatif
su. hendra,1,"hari selasa tgl 21 april sy isi dana Rp 50 ribu melalui alfa midi , hari sabtu tgl 25 april isi dana melalui alfamart & indomaret sebesar Rp 50.000 dikenakan adm Rp 2.000 dan dibyr dimuka sebesar Rp 52.000, waktu saldo dana msk kenapa saldo dana berkurang Rp 1.500. cuma isi saldo dana knp saldo dana berkurang ? potongan Rp 1.500 biaya apa ? lebih baik pakai cash lebih hemat. sungguh mengecewakan apk dana.",selasa tgl april sy isi dana rp ribu alfa midi sabtu tgl april isi dana alfamart indomaret rp kena adm rp dibyr muka rp saldo dana msk saldo dana kurang rp isi saldo dana knp saldo dana kurang potong rp biaya pakai cash hemat sungguh kecewa apk dana,negatif
Anggi Sitinjak,1,hape hilang nomor hilang sehingga tidak bisa menerima kode otp lagi sudah 2 bulan chat diana katanya nunggu diproses nnti di kabari lewat gmail sudah 2 bulan lebih gdk jawaban,hape hilang nomor hilang terima kode otp chat ana nunggu proses nnti kabar gmail gdk,netral
Ariel lampu,1,"bagus aplikasinya tapi sayang nya punya saya blum ada dana instan nya jadi percuma gak ada yang asik, cuman bisa tf atau isi pulsa dll",bagus aplikasi sayang nya blum dana instan nya asik cuman tf isi pulsa dll,positif
Rk Rk,1,males sekarang kaya kartu bank aja pake KTP identitas segala,males kaya kartu bank aja pake ktp identitas,netral
kholisoh,1,Kacauuu kasus pencurian uang ttp masih lolos diapk ini,kacauuu curi uang ttp lolos diapk,netral
Nailatul Nadia,1,"ga berguna, katanya dompet digital tapi apa ini, masa nyimpen saldo di dana goals ga bisa di tarik, di suruh verifikasi muka tapi malah ga ke deteksi, gimana si lain kali kalok buat aplikasi itu yang proper, kalok kayak gini gimana? siapa yang mau ganti uang nya? gak jelas",guna dompet digital nyimpen saldo dana goals tarik suruh verifikasi muka deteksi gimana si kali kalok aplikasi proper kalok kayak gin gimana ganti uang nya,netral
PARIS ABQORI,1,"aduhh minn,,, dana aku udah aku di premium in tapi kok pas mau coba ambil qr sendiri kok gabisa, padahal katanya pengerjaan nya 2-3 hari ini udah lebih mau hari ke 5 setiap hari saya cek ke dana bisnis tetep ada bacaan toko tidak ada sama coba lagi saya pencet gabisa bisa tolong min kasih tau penyebabnya,,,,.",aduhh minn dana udah premium in pas coba ambil qr gabisa kerja nya udah cek dana bisnis tetep baca toko coba pencet gabisa tolong min kasih tau sebab,netral
Unique Florist,1,dana cicil tidak bisa digunakan lagi padahal sudah bayar lunas parahh,dana cicil bayar lunas parahh,netral
Maulana Ikhsan,1,"aku top up dana tapi ngga masuk, tanya di cs apk nya udah aku kasih bukti top up malah katanya tidak sesuai, pdhl logo dari permata bank udah ganti lumayan lama sekitar 2 bulan lalu, sedangkan dana tidak update akan hal itu, JD bukti yang aku kasih ngga diterima, sayang sekali pdhl udah pakai dana lama, ngga pernah sekecewa ini",top up dana ngga masuk cs apk nya udah kasih bukti top up sesuai pdhl logo permata bank udah ganti lumayan dana update bukti kasih ngga terima sayang pdhl udah pakai dana ngga kecewa,positif
Bagus Fratama,1,saya ingin mengirim uang karena keadaan genting malah minta di suruh upgrade akun ke premium dan untuk upgrade akun minta waktu 2 hari pelayanan apaan ini malah dipersulit,kirim uang genting suruh upgrade akun premium upgrade akun layan sulit,netral
dedy susilo,1,uang di dana saldo saya hilang tp saya sudah laporan katanya sudah sesuai prosedur pembelian padahal saya tidak merasa melakukan transaksi itu.....,uang dana saldo hilang lapor sesuai prosedur beli transaksi,positif
Setiyaman Nazara,1,dana saya kepotong dari apk capcut tampa sepengetahuan saya,dana potong apk capcut tampa tahu,netral
Andy Wibowo,1,fitur dana cicil hapus aja tidak berguna ada limit tidak bisa di gunakan,fitur dana cicil hapus aja guna limit,netral
Sukaeci 403,1,makin kesini malah sering gangguan gblok,kesini ganggu gblok,netral
Enday Jayani,1,Padahal sudah upgrade tapi tetap tidak bisa digunakan.,upgrade,netral
Sakina Agus,1,sangat tidak memuaskan akun udah premium transfer udah banyak tp gak ada fitur dana instant dan dana cicil,muas akun udah premium transfer udah fitur dana instant dana cicil,netral
rudi yanto,1,costumer service dana susah d hubungi saya butuh bantuannya mohon admin memperbaiki nya,costumer service dana susah d hubung butuh bantu mohon admin baik nya,netral
mhmmd riffki_,1,"kagett aja gitu dana pacar saya ilang tiba tiba di dana,tolong bantuannya dong,dicek mutasi gada mutasi transfer",kagett aja gitu dana pacar ilang dana tolong bantu cek mutasi gada mutasi transfer,netral
Tachikawa Ritsuki (Ritsuki),1,"LEMOT PAYAH,APAAN SELALU KATANYA "" BANYAK YANG SEDANG TRANSAKSI "".....GAGAL MULU MAU NGIRIM DUIT KARNA ITU JADI MALU....",lot payah transaksi gagal mulu ngirim duit karna malu,negatif
Herman Ja,1,pihak dana atau karyawan nya sendiri udah mulai rakus mau komplain juga percuma hehe,dana karyawan nya udah rakus komplain hehe,netral
Feri Kismanto,1,kenapa dana cicil saya yang tadinya ada kok malah di hilang kan,dana cicil hilang,netral
Aarif Arsya,1,Saya menggunakan DANA ± 3 tahun tapi sya sangat kecewa sebab dana cicil 100 Ribu yg tersedia dan tidak bisa di gunakan,dana sya kecewa dana cicil ribu sedia,negatif
Naura Pesek,1,knp saya tidak menerima kode otp?,knp terima kode otp,netral
Muhammad Nabhan,1,"bagaiman ini mau login no hp tidak aktif JD ribet ,pahadal ada email dan password benar duh",bagaiman login no hp aktif ribet pahadal email password duh,negatif
ISMAN Doni,1,"aplikasi yg tidak bisa membantu, karena aplikasi ini bisa di bobol sama orang yg tidak bertanggung jwb dan tida ada solusi dari pihak aplikasi nya sendiri yg ada prtanyaan nya di bolak balik sama pihak apk ini padahal jelas"" pengguna apk ini melaporkan bahwa saldo di apk nya ad 500ribu dan tiba"" ada yg ngambil di belikan nya ke pulsa saldo saya, dan laporan saya ke pihak aplikasi hanya mendapatkan jwbn yg di putar"" tida bisa membantu, aplikasi macem apa ini",aplikasi bantu aplikasi bobol orang tanggung jwb tida solusi aplikasi nya prtanyaan nya bolak apk guna apk lapor saldo apk nya ad ribu ngambil belikan nya pulsa saldo lapor aplikasi jwbn putar tida bantu aplikasi macem,netral
Pengangguran Belum Kerja Lagi,1,"aplikasi lemot sering gangguan, IT nya gak becus!!!",aplikasi lot ganggu it nya becus,netral
Yantie Anyer,1,buruk👎👎👎,buruk,negatif
25-Moh. Fuad Agil Mustofa,1,ini kenapa ya aku kok mau kirim uang sudah 2x tapi yang penerima tidak menerima status berhasil nama dan rekening sudah sama ini kenapa woy,ya kirim uang x terima terima status hasil nama rekening woy,netral
Kak Nanda,1,gntj nomer hp susah,gntj nomer hp susah,negatif
Yudi Ajah,1,dana saya hilang waktu 2025 bulan mei tanggal 10 apakah bisa di bantu kembalikan hilang 500 ribu,dana hilang mei tanggal bantu kembali hilang ribu,netral
Aulia Rahma Dewi,1,"uang kesedot sendiri, TF gajelas ke nomor lain, apk jelek, gajelas, ga aman",uang sedot tf gajelas nomor apk jelek gajelas aman,netral
Farel Farelgendeng,1,tidak bisa masuk ke dalam dana,masuk dana,netral
Azzahra,1,buruk,buruk,negatif
Sasuke Uchiha,1,KENAPA GA BISA QR GANGGUAN COK,qr ganggu cok,netral
Rena Riani,1,"ngga membantu samsek, bikin HP saya jadi ngelag parah",ngga bantu samsek bikin hp ngelag parah,negatif
Dadan Rohimat,1,"udah lama pakai dana ,tapi untuk dana cicil nya gak pernah muncul,maaf di kasih bintang 1 dulu ,kalau sudah bisa pakai dana cicil saya kasih bintang 5",udah pakai dana dana cicil nya muncul maaf kasih bintang pakai dana cicil kasih bintang,netral
Reza Ardiansyah,1,apk ngak waras masak mau tf muter² terus,apk ngak waras masak tf muter,netral
Akbar Faizan,1,sangat membantu,bantu,netral
Rivan Willy,1,dana bngst tiba tiba nyedot sendiri saldo nya,dana bngst nyedot saldo nya,netral
Alifa Alifa,1,"aplikasi apaan kayak gini ngescan QR kagak Bisa malah burem kalok udah bener, CACAT.",aplikasi kayak gin ngescan qr kagak burem kalok udah cacat,netral
Umar,1,saya kan ingin login tapi harus di minta kode lewat email tapi email nya hilang jadi gmna mau login nya,login kode email email nya hilang gmna login nya,netral
Kesya Nurul,1,"tolong untuk chat bot nya di hilangkan caht bot ngga guna ber belit """,tolong chat bot nya hilang caht bot ngga ber belit,netral
Sopia Oke,1,GK mau di bukak lagi dn nya...kmarin enk bukak dnnya,bukak dn nya kmarin enk bukak dnnya,netral
ANTON NOFRI,1,susah login...tidak bisa melakukan pembayaran melalui..kode Sken Qris,susah login bayar kode sken qris,negatif
Fanny Cantik,1,"aplikasi tolol,, tidak aman uang lama2 di sini, gampang di hack saya oernah duit urgent malah hilang, tidak ada penyelesaian, customer service nya bwetele tele...",aplikasi tolol aman uang gampang hack oernah duit urgent hilang selesai customer service nya bwetele tele,positif
Alivia Azzahra,1,Tolonga lakukan konfimasi sebelum memotong uang dari akun,tolonga laku konfimasi potong uang akun,netral
Dwi Cahyadi,1,itu kenapa maksimal top up cuma 450 rb ??? pelit amat,maksimal top up rb pelit,positif
Bass kara,1,ngescan ga bisa pengembalian dana lama laporan di tanggapi lama apa apa gabisa rusak ini apk,ngescan kembali dana lapor tanggap gabisa rusak apk,negatif
Aldi Nugraha,1,dana enggak ada perbaikan minta bantuan ke sistem Diana siap membantu malah ngawur pokoknya dana parah banget 2026 sekarang tidak di rekomendasikan untuk sekarang sekarang parah,dana baik bantu sistem ana bantu ngawur pokok dana parah banget rekomendasi parah,positif
Hanafi Kurniawan,1,apk konyol pindah akun gagal terus,apk konyol pindah akun gagal,negatif
Ogi Neta,1,aplikasi GK jelas,aplikasi,netral
Olivia Permata sari,1,dana aplikasinya parah banget csnya gak bisa bantu dilempar lempar melulu. chat Diana pertanyaan apa dijawab apa. email ke cs panjang x lebar dijawabnya suruh chat di aplikasi dana yg chat Diana. giliran di telepon sibuk melulu habisin pulsa. aplikasi sampah,dana aplikasi parah banget csnya bantu lempar lempar melulu chat ana email cs x lebar jawab suruh chat aplikasi dana chat ana gilir telepon sibuk melulu habisin pulsa aplikasi sampah,negatif
ular Harimau,1,"akhir2 ini pas TF ke bank selalu telat,mulai skrng transaksi gede jgn pake dana delay terus, prosesnya juga lama",pas tf bank telat skrng transaksi gede jgn pake dana delay proses,negatif
Erliani Tanjung,1,"limit dana cicil saya masih ada, tapi saya tidak bisa menggunakan nya, kalau begini terus dana, jangan salah saya menjadi nasabah yang tidak baik, ingat kita perlu hubungan timbal balik yaa",limit dana cicil nya dana salah nasabah hubung timbal yaa,netral
Muhammad Cahya,1,"Dana cicil saya tidak bisa di pake, padahal bekum pernah pinjam",dana cicil pake bekum pinjam,netral
kir dan,1,"saya sudah tidak isi saldo dana lagi karena dana cicil selalu tidak tersedia padahal masih ada limit 100rb, ini bentuk protes saya terhadap dana",isi saldo dana dana cicil sedia limit rb bentuk protes dana,netral
Misrawati Misrawati,1,bagus sekali,bagus,positif
Ari Gunawan,1,woi Dana kenapa ini sistem keamanannya kacau banget akhir² ini. saldo dana tiba² terpotong aja oleh aplikasi gak dikenal yang bahkan kita gak instal dan gak berlangganan dan semua itu tanpa melalui proses memasukkan sandi atau pin keamanan dari akun Dana kita. saya hari ini tanggal 22 april 2026 saldo dana saya terpotong yang tadinya 212.000 kini tinggal 80.000 dan itu terpotong oleh aplikasi gak dikenal dan gak ada di hp saya. bagaimana ini solusi dan tanggung jawabnya?!!,woi dana sistem aman kacau banget saldo dana potong aja aplikasi kenal instal langgan proses masuk sandi pin aman akun dana tanggal april saldo dana potong tinggal potong aplikasi kenal hp solusi tanggung,positif
Dwi Septian,1,Gak bisa hapus akun bikin kesal,hapus akun bikin kesal,netral
Dede Jamil,1,Semenjak DNS saya matikan kok Dana ada iklan Judol nya sih,semenjak dns mati dana iklan judol nya sih,netral
Mazfounk mawon,1,buruk,buruk,negatif
siti tohiroh,1,"apk sampah,pemakaian sudah bertahun tahun dan uang masuk keluar sudah puluhan juta,fitur dacil tidak pernah muncul,kebijakan internal yang tolol seenak nya tidak nilai seseorang,,jangan pernah pakai apk dana lagi,hapus dari hp buang jauh jauh apk sampah",apk sampah pakai tahun uang masuk puluh juta fitur dacil muncul bijak internal tolol enak nya nilai pakai apk dana hapus hp buang apk sampah,netral
Unyil Ariska,1,apk melelah kan di buat tf nunggu verifikasi dulu,apk lelah tf nunggu verifikasi,netral
Kontol Buto,1,"jika sampai nanti malam uang saya yg di makan tiktok gak balik, aku hapus aplikasi dana, dan aku pastikan aplikasi dana gak bakal ada yg pakek lagi,, akan aku sebar luaskan",malam uang makan tiktok hapus aplikasi dana pasti aplikasi dana pakek sebar luas,netral
Faitur Rahman,1,katanya( koneksi terputus/ tidak ada jaringan) lah terus gw pakek wifi scrol tiktok kok bisa jir .. mana ada uangnya lagi 20 ribu kan lumayan beli jajan ...perbaiki lah woiy,koneksi putus jaring gw pakek wifi scrol tiktok jir uang ribu lumayan beli jajan baik woiy,positif
Agung Sutejasembiring,1,"tidak recommended utk penggunaan transaksi besar dan putaran saldo harian slow respon live chat Diana, dan sering saldo pengembalian lama proses 👎👎👎",recommended utk guna transaksi putar saldo hari slow respon live chat ana saldo kembali proses,netral
Dama Duri,1,"aplikasi ini ngk bgsss , masak saya isi dana 200 ribu di potong 83 ribu, kirim ke Gugel kan gila aplikasi ini , balikin dana saya udh 2 kali kayak ngini di potong""",aplikasi ngk bgsss masak isi dana ribu potong ribu kirim gugel gila aplikasi balikin dana kali kayak ngini potong,netral
Muhamad Ilham hakiki,1,katanya keamanan terjamin saya sudah aktif kan paskey dan dana premium masih aja kecopetan bukan sekali tapi berkali kali saya tidak akan pakek dana lagi,aman jamin aktif paskey dana premium aja copet kali kali pakek dana,positif
Cup Clip,1,masa saya udh pake dana lebih 5 tahun gak muncul dana cicil transaksi sampe puluhan juta,pake dana muncul dana cicil transaksi sampe puluh juta,netral
Andhika Poetra,1,aplikasi gajelas saldo tiba tiba berkurang sendiri,aplikasi gajelas saldo kurang,netral
Doni Saputra,1,aku pengen hapus akun dana.. tapi gak bisa .. katanya masukin email.. kan emai memang sudah masuk.. anehh..saat daftar kan ada email masuk.. tapi kok suruh masukin email lagi tertulis NOT FOUND,ken hapus akun dana masukin email emai masuk anehh daftar email masuk suruh masukin email tulis not found,netral
Vin an,1,tolong kenapa saya tidak ada dana cicil nya,tolong dana cicil nya,netral
Agil joko Praz,1,dana ribettttttt mau top aja jam pakai dibatasi bikin soal aja asw,dana ribettttttt top aja jam pakai batas bikin aja asw,positif
Tarjo Pos,1,jlk susah frekasih wajah..ribet,jlk susah frekasih wajah ribet,negatif
Wahyu Agus,1,bagus,bagus,positif
Arik Arik,1,"Aplikasi sialan, utang pulsa hanya 50 rb, bayarnya sampai 200 ribuan, tidak pernah utang pulsa Telkomsel ko' ada tagihannya,",aplikasi sial utang pulsa rb bayar ribu utang pulsa telkomsel ko tagih,netral
3E_275_Iqbal Valentino Zulfan,1,"Saya tidak bisa login, di minta masukkan pin, tapi selalu salah..... padahal pin sudah benar",login masuk pin salah pin,netral
ipan buster,1,ko di apk dana saya engga bisa aktifin fitur dana cicil perlayanan sangat buruk jawab nya dan pertanyaan itu lagi itu lagi gimana sih,ko apk dana engga aktifin fitur dana cicil layan buruk nya gimana sih,negatif
xyzbet4,1,"topup dari mbanking kena tambahan , begitu masuk ke akun dana , kena potongan. alhasil saldo yang seharusnya pas jadi berkurang lagi . nggak seberapa sih , cuman makin kesini makin parah nih dana kalo ambil potongan. dancuk emang",topup mbanking kena tambah masuk akun dana kena potong alhasil saldo pas kurang sih cuman kesini parah nih dana kalo ambil potong dancuk emang,negatif
Jamil,1,saya benci tagihan dana cicil padahal saya tidak pernah nyicil tolong pihak apk ini betulkan lah rugi kita,benci tagih dana cicil nyicil tolong apk betul rugi,netral
Zaharuddin Din,1,saya baru ganti no rek isi dana pertama 100k. eh malah di ambil setan jadi sisanya 67k.. kok gitu ya,ganti no rek isi dana k eh ambil setan sisa k gitu ya,netral
Cu an,1,tidak terupdate dengan handphone baru,terupdate handphone,netral
Mhmd Akmal,1,ko gabisa tf si ada proses kendala terus,ko gabisa tf si proses kendala,netral
fakhrur roji,1,mau isi kartu emoney malah gamasuk tapi saldo berkurang,isi kartu emoney gamasuk saldo kurang,netral
Rifki Afdillah,1,"GAA WOR IT QRIS BISNIS GUA GA SIAP"" PADAHAL UDAH 1 BULAN PROSES TERUA",gaa wor it qris bisnis gua udah proses rua,netral
Darmawan Sidik,1,jelek kotnol,jelek kotnol,negatif
Dandi Aditya,1,sudah berapa kali hilang uang di aplikasi dana,kali hilang uang aplikasi dana,netral
Mega mawarni,1,"nda jelas dana mau tf ke lain aja ribet betul harus upgrade "" nda jelas sdh di masukan data harus nunggu lagi mending ke apk sebelah aja dari pada dana ini",nda dana tf aja ribet upgrade nda masuk data nunggu mending apk belah aja dana,negatif
Taufik Sapoy,1,"hari ini ga jelas keamanan nya duit w pas di TLP dari pihak dana di nyatakan dana di bekukan eh malah hilang saldo nya,di kuras habis 427rb,blm tau deh masih bisa dipercaya apa ga,skrg aj blm bisa di buka LG aplikasi nya ga bisa di buka loding terus....",aman nya duit w pas tlp dana nyata dana beku eh hilang saldo nya kuras habis rb tau deh percaya skrg aj buka lg aplikasi nya buka loding,positif
Mawan Kusmawan,1,kacau udah bertahun tahun pake dana transaksi setiap saat tapi piltur dana cicil nya belum muncul juga sementara yang baru punya dana udah muncul kecewa sama pelayanan dana,kacau udah tahun pake dana transaksi piltur dana cicil nya muncul dana udah muncul kecewa layan dana,negatif
Matori man,1,saya tarik saldo fizzo ke dana hari Sabtu 18 April 2026 dan sudah dilaporkan ke customer care saldo belum masuk sampai sekarang belum ada solusi.. sangat mengecewakan.. kayaknya pakai gopay lebih baik kali y,tarik saldo fizzo dana sabtu april lapor customer care saldo masuk solusi kecewa kayak pakai gopay kali y,negatif
Malmsteen,1,saya sudah lama pakai dana dan udah premium tapi di saya gak ada fitur dana cicil nya padahal teman saya yang baru pakai langsung ada fitur dana cicil nya,pakai dana udah premium fitur dana cicil nya teman pakai langsung fitur dana cicil nya,netral
Fahrul Rozi,1,dana cicil saya hilang kmbli,dana cicil hilang kmbli,netral
San Comel,1,dana tidak aman saya sebagai pengguna dana merasa di rugikan saldo saya sering hilang,dana aman guna dana rugi saldo hilang,positif
Fahtar,1,"sumpah kenapa dah, dana sekarang banyak bug, error dll, padahal dulu bagus ini aku kena bug atau error lagi ga bisa tranfer logo semuanya jadi putih ngeleg, tolong cepet di betulin profesional lah",sumpah dah dana bug error dll bagus kena bug error tranfer logo putih ngeleg tolong cepet betulin profesional,negatif
Ayu Thea,1,DANA APLIKASI SAMPAH KAGA GUNA ADA DAN CICIL KAGA BISA AKTIVASI PAKE DANA TIAP HARI JUGA,dana aplikasi sampah kaga cicil kaga aktivasi pake dana,netral
Andhy Putra,1,"JANGAN DONLOD APK DANA BENER2 GA AMAN ,, SALDO SAYA HILANG PIHAK DANA TIDAK MW GANTI SLOGAN 100% DANA KEMBALI JIKA HILANG / DI BOBOL PENIPU",donlod apk dana aman saldo hilang dana mw ganti slogan dana hilang bobol tipu,netral
Heru Kurniawan,1,"ga bisa lagi pakai dana cicil 🙄, telat bayar , padahal dah lama dilunasin,🤦",pakai dana cicil telat bayar dah dilunasin,negatif
Vildi Febialdi,1,uang saya hilang begitu sajah saya mohon tolong kembalikan uang saya karena saya tidak terima atas transaksi google yang tiba tiba terpotong,uang hilang sajah mohon tolong kembali uang terima transaksi google potong,netral
Prisillia,1,jelek udh isi no wa TPI ga kekirim kode nya burikk,jelek isi no wa tpi kirim kode nya burikk,negatif
Muhammad Ivan,1,"aplikasi yang benar² membingungkan mau pindahin akun ke nomor lama gak bisa karena harus otp,bisa tapi harus ngosongin saldo gimana ceritanya ngosongin saldo tapi ktp udah dipakai diakun lama,hubungi CS sama aja ngak membantu sama sekali dan di akun lama itu masih ada sedikit uang🥲🥲",aplikasi bingung pindahin akun nomor otp ngosongin saldo gimana cerita ngosongin saldo ktp udah pakai akun hubung cs aja ngak bantu akun uang,netral
ALVAN PRATAMA,1,kenapa apk dana ku kok gak bisa di instal,apk dana ku instal,netral
Ryas Syauqi,1,aplikasi taikk gak jelas,aplikasi taikk,netral
Dandi Indri,1,mulai detik ini gua ga pake apk maling kaya gini saldo gua ilang tanpa persetujuan dari pemilik akun tiba2 terpotong padahal ga pernah ngasih otp/ yg lain nya,detik gua pake apk maling kaya gin saldo gua ilang tuju milik akun potong ngasih otp nya,netral
Kurniawan Pga,1,"GK jelas dana sekarang masak beli paket data 8gb, 54rb yg masuk cuman 4,5 GB",dana masak beli paket data gb rb masuk cuman gb,netral
hati laskar cinta,2,"tolong di perbaiki lagi bos,, kalau motong saldo akun dana cicil harus ada bukti pemotongannya dari aplikasi. saya kasih bintang ⭐⭐ dulu sampai ini di perbaiki lagi..",tolong baik bos motong saldo akun dana cicil bukti potong aplikasi kasih bintang baik,positif
Bilal Rizfaxi,2,bgus sangat menarik,bgus tarik,netral
Rukis Ardiyansah,2,udah 5 tahun lama pake apk dana blom di kasih aja dana cicil tolong dong min,udah pake apk dana blom kasih aja dana cicil tolong min,netral
Apa Nurul,2,sangat membantu,bantu,netral
Puttri Puttry,2,"tolong Aplikasi DANA nya di perbaiki lagi yaaa, kenapa tiba-tiba potong uang 1000, 5000 padahal dulu gak gini..",tolong aplikasi dana nya baik yaaa potong uang gin,positif
Gilang Prasetyo,2,"kenapa tidak bisa login padahal no telp sudah benar, sudah di coba uninstall dan install ulang aplikasi tetap saja tidak bisa. keterangan jaringan error",login no telp coba uninstall install ulang aplikasi terang jaring error,negatif
Dea Savina,2,ada limit tapi gak bisa di pake,limit pake,netral
Adef Vasco,2,dana kok menolak pembayaran,dana tolak bayar,netral
Mamas M1467,2,Fitur dana cicil gak muncul muncul,fitur dana cicil muncul muncul,netral
Virus Kokok12,2,saldo saya bisa hilang,saldo hilang,netral
