user_name,score,content,clean_content,sentimen
Hobi Abdi,2,mengapa harus menggunakan Wi-Fi tidak bisa pakai data/kuota,wi fi pakai data kuota,netral
rifki lemu,2,"tolong perbaiki dana cicil saya dong minn, masak pertama kali muncul sampe sekarang nggak bisa di pakek",tolong baik dana cicil minn masak kali muncul sampe pakek,positif
Pratiwi Putri AudiNingsih,2,ribet bngt mau payment pke dana. udh 3x verifikasi ttp aja ga nyambung2. akun nya.,ribet bngt payment pke dana x verifikasi ttp aja nyambung akun nya,negatif
Arip Wibowo,2,akun dana cicil saya tidak bisa di gunakan. tolong bantuan ny padahal saldo dana cicil ny ada limit 100 ribu. tapi tidak bisa di gunakan percuma,akun dana cicil tolong bantu ny saldo dana cicil ny limit ribu,netral
Ayus Sius,2,hampir tiap minggu Update melulu kerjaan coba sekalian,minggu update melulu kerja coba,netral
Baya Nanda,2,"menurut saya aplikasi ini lumayan praktis buat simpan uang, bisa buat sayang lebih hemat juga karena bisa liat pengeluaran berapa. tapi tolong dong keamanan nya di tingkatkan lagi, saya pernah kehilangan uang 900 ribu di akun dana, tiba tiba aja uangnya hilang, sepertinya di retas atau apalah. semenjak itu jadi trauma simpan uang disini lagi.",aplikasi lumayan praktis simpan uang sayang hemat liat keluar tolong aman nya tingkat hilang uang ribu akun dana aja uang hilang retas apa semenjak trauma simpan uang,positif
muhammad romli,2,"saya sudah pelunasan dana instan tp pas mau penarikan kembali malah tidak bisa terus,gimana sih ,niat ga sih kasih pinjaman nya,bikin ga kompeten",lunas dana instan pas tari gimana sih niat sih kasih pinjam nya bikin kompeten,netral
driver Traktor,2,"mau pakai dana cicil kok udah ngga bisa,,,buat beli pulsa,,",pakai dana cicil udah ngga beli pulsa,netral
Nanda Aika,2,tolong di hapus notifikasi ocean itu sangat sangat terganggu.,tolong hapus notifikasi ocean ganggu,netral
Ahmad Harahap,2,kapan dana cicil saya bisa muncul di akun saya dan bisa saya gunakan sudah lama saya pake dana sampe sekarang juga belum Ada muncul dana cicil nya,dana cicil muncul akun pake dana sampe muncul dana cicil nya,netral
Riko Al Adima,2,"saya kesulitan mau minta bantuan cs sudah chat diana sudah kirim email belum ada respon terkait kendala dana cicil saya tidak bisa digunakan, padahal limit tersedia dan pembayaran tidak pernah terlambat, mohon dibantu min🙏",sulit bantu cs chat ana kirim email respon kait kendala dana cicil limit sedia bayar lambat mohon bantu min,negatif
Nofi Ike Wulandari,2,akhir2 ini pengiriman gagal nggak tau kenapa padahal biasanya enak2 aja,kirim gagal tau enak aja,negatif
Danar Hudha,2,APKmu uaboot butuh HP Ram 80 ta ?,apkmu uaboot butuh hp ram ta,netral
Resky Haryanto,2,"SDH sya tunggu berhari"" TF ke sesama e wallet masalah terus smpai skrg",sya tunggu hari tf e wallet smpai skrg,netral
Fisshabilla Bella,2,kurang kumplit,kumplit,netral
Toyo Taa,2,premiumnya tidak bisa di pindah,premium pindah,netral
Farel Ridiansyah,2,apk aneh masa login cuman pake no doang no ku dah mati trs di dana Masih ad uang ratusan ribu bikin fitur login pake KTP atau yg lain nya kek,apk aneh login cuman pake no doang no ku dah mati dana ad uang ratus ribu bikin fitur login pake ktp nya kek,netral
Ahmad Suwardi,2,apk nya sering keluar sendiri. apa solusinya,apk nya solusi,netral
Lee Amin23,2,gak ada dana cicil,dana cicil,netral
Mekeh Eh,2,qr dana bisnis gak muncul dan sudah melewati batas waktu yang ditentukan,qr dana bisnis muncul lewat batas tentu,netral
Iwan Siu,2,"aplikasi nya kurang baik, saya invest emas harganya naik tapi uang saya berkurang",aplikasi nya invest emas harga uang kurang,netral
ferigiofani Abraham,2,Saya kasi bintang 1 soalnya g dpet dana cicil,kasi bintang g dpet dana cicil,netral
Imam Hardy 12,2,"dana sering hilang,kadang ga masuk saat pengiriman uang",dana hilang kadang masuk kirim uang,netral
Alifah Aleyna,2,kenapa pihak dana klu ada masalah seperti ini selalu slow respon. saya kurangi aja bintang nya SDH terlalu lama nunggu tp belum diproses juga saya kembali kan lagi ulasan saya dengan terbaik dan saya kasih semua bintang asalkan masalah saya mengenal otp terselesaikan.,dana klu slow respon kurang aja bintang nya nunggu proses ulas baik kasih bintang kenal otp selesai,positif
Fauzan Galih,2,"hapus aja dana kalo gak bisa transaksi, tiap hari ganguan mulu perasaan, dana rusak apa gimana si, kalo gak bisa transaksi hapus aja apk busuk ini",hapus aja dana kalo transaksi ganguan mulu asa dana rusak gimana si kalo transaksi hapus aja apk busuk,negatif
Wiby Kikilaitety,2,"kenapa sekarang susah bangett buat masuk ke dana,selalu saja gangguan sinyal, Tolong donk gimanaa sie",susah bangett masuk dana ganggu sinyal tolong donk gimanaa sie,negatif
Jefri Hendra,2,"bayar ngk pernah telat limit nya ngk nambah nambah, dah lunas mau buat beli paketan ngk bisa",bayar ngk telat limit nya ngk nambah nambah dah lunas beli paket ngk,negatif
Renn Auu,2,"kok setiap scan wajah untuk pembayaran selalu gagal ya, tolong dong masa iya gagal Mulu padahal sinyal bagus terus wajah aku juga tidak berubah tapi kok gagal teruss",scan wajah bayar gagal ya tolong iya gagal mulu sinyal bagus wajah ubah gagal teruss,negatif
Rais Mubaraq,2,menyenangkan,senang,positif
Jangkung Asep,2,dana makin jelek semenjak di update. lemot kaya keong racun....,dana jelek semenjak update lot kaya keong racun,negatif
Jullian Draxler,2,aneh buat apah ada dana cicil limit udh ada tapi giliran mau pake malah tidak tersedia,aneh apah dana cicil limit gilir pake sedia,netral
Polem Thabrani,2,akhir akhir ini meng ngecewakan dana limit di lunasi sebelum jatuh tempo hanya terpakai 2x aja seterusnya masih blm bisa kepakai ngapain juga kasih dana cicil gak guna.. bukanya naik limitnya malah ini gak bisa kepakai sama sekali,meng ngecewakan dana limit lunas jatuh tempo pakai x aja pakai ngapain kasih dana cicil buka limit pakai,netral
Entis Chanel,2,"saldo sudah terpotong bayar shopee pake qris, laporan berhasil, tapi pihak penjual membatalkan alasan belum dibayar, saldo hilang tak kembali,",saldo potong bayar shopee pake qris lapor hasil jual batal alas bayar saldo hilang,netral
Fergio Fani,2,"kenapa gak bisa transaksi ya sekarang? tiap mau transaksi malah muncul ""ups, tidak ada koneksi internet, cek nanti lagi ya."" emang aneh ni apk sekarang",transaksi ya transaksi muncul ups koneksi internet cek ya emang aneh ni apk,netral
syahrizal nasution,2,mengapa fitur dana cicil saya gak ada,fitur dana cicil,netral
Asep Solihin,2,aman dan amanah,aman amanah,positif
Tugas_andhika_xte4,2,"pembelian di tolak terus, padahal saldo saya lebih dari cukup",beli tolak saldo,netral
Satria Putri,2,DANA CICIL HANYA TAMPILAN GAK BISA DIGUNAKAN SAMA SEKALI AUTO UNINSTALL,dana cicil tampil auto uninstall,netral
Andi Soek,2,apakah dana ga punya pkrja.. smpai smpai balasan cht dari pengguna cuma di bls mnggunakn ketikan komputer..stiap kli cht..blsan itu itu doang yg tmpilkn... tmbh lgi sy minta dana cicil sy di aktivkn kmbali .TPI smpai skrng blom juga di aktivkn.. parah..,dana pkrja smpai smpai balas cht guna bls mnggunakn keti komputer stiap kli cht blsan doang tmpilkn tmbh lgi sy dana cicil sy aktivkn kmbali tpi smpai skrng blom aktivkn parah,negatif
Madex xxx,2,"sampai tak hapus ganti gopay, gara gara langganan aplikasi melolo nyedot saldo terus tanpa konfirmasi, minta Diana blokir jawabannya muter muter terus, ampun pak pusing ...",hapus ganti gopay gara gara langgan aplikasi melolo nyedot saldo konfirmasi ana blokir jawab muter muter ampun pusing,netral
Kyky Risky,2,"bug Mulu di dana bisnis, di tarik saldo , verifikasi wajah, udah diem, no respon nggk ada kata gagal ato apa diem doang",bug mulu dana bisnis tarik saldo verifikasi wajah udah diem no respon nggk gagal ato diem doang,negatif
Muhammad RizqyFarkhi,2,aplikasi ga jelas tf ksana ksini gabisa harus upgrade,aplikasi tf ksana ksini gabisa upgrade,netral
Purwa Raha,2,uang saya tiba-tiba hilang tanpa transaksi,uang hilang transaksi,netral
Mamaarya Mamaarya,2,kenapa punya aplikasi dana cicilan belum muncul ya,aplikasi dana cicil muncul ya,netral
Agus Nugraha,2,kenapa dana cicil saya tidak bisa di pakai padahal limit ada...tagihan semua udah d lunasin,dana cicil pakai limit tagih udah d lunasin,netral
Nicholas Bagus21,2,mau bayar pake qris ada kendala mulu mohon dibenerin min,bayar pake qris kendala mulu mohon dibenerin min,netral
Ifdail Ifdail (Ifdail),2,saldo saya hilang buat tagihan pls padahal saya tdk pernah utang pls dan pls ya tdk ad yg masuk,saldo hilang tagih pls tdk utang pls pls ya tdk ad masuk,netral
Penjelajah_Anime,2,"Harusnyah buka apps DANA gak perlu punya paket data, sipa juga yang mau lama-lama buka apps DANA, jika perlu paket data malah mempersulit pembelian dan pembayaran dalam aplikasi.",harusnyah buka apps dana paket data sipa buka apps dana paket data sulit beli bayar aplikasi,netral
sinta Riyani,2,saya belum ada fitur dana cicil pdahal transaky selalu pke dana mohon di aqun dana saya ada fitur dana cicil,fitur dana cicil pdahal transaky pke dana mohon aqun dana fitur dana cicil,netral
Rika Tri Kusumawati,2,"akhir-akhir ini kendala dengan banyak transaksi di aplikasi ini, sehingga terkendala juga. cuman sy berharap segera diatasi permasalahannya.",kendala transaksi aplikasi kendala cuman sy harap atas masalah,netral
Tisna Maulana,2,belum Ada Dana cicil disaya. padahal sudah sering aktif Dana nya,dana cicil saya aktif dana nya,netral
Rendi Prasetya,2,"banyak kale sistem eror,gangguan mulu dah",kale sistem eror ganggu mulu dah,netral
Siti nurrohmah,2,"dana skrng jelek, buka aplikasi gabisamulu, harus diuninstal didonlot lg baru bisa buka. maksudnya apaan si njir",dana skrng jelek buka aplikasi gabisamulu diuninstal didonlot lg buka maksud si njir,negatif
Aditya Anggara,2,"tidak bisa diinstal di perangkat redmi pad se,sedikit kecewa TPI GPP udh biasa : |",diinstal perangkat redmi pad kecewa tpi gpp,negatif
Muhammad Taufik,2,makin di aupdet makin mahllll,aupdet mahllll,netral
Andi Setiawan,2,dana cicil tidak bisa di gunakan trs,dana cicil,netral
Abu Qinan,2,kadang ngeleg tidak bisa di pakai,kadang ngeleg pakai,netral
MuzaNafis,2,rebet daftar di Dana membingungkan gak kelar kelar,rebet daftar dana bingung kelar kelar,netral
Rizzik,2,"Aplikasi sakit, susah sembuhnya",aplikasi sakit susah sembuh,negatif
Yaya Juhria,2,Saya mendonlod dan menginstal dana tapi kenapa susah dibuka.mohon diperbaiki ada apa keslahannya,mendonlod menginstal dana susah buka mohon baik slah,netral
Karmiyati Yati,2,tidak bisa login dan tidak ada respon dari pihak dana sedagan di dalam akun lama ada saldonya cuma karna gk bisa login karna nomornya hangus,login respon dana sedagan akun saldo karna login karna nomor hangus,netral
Haikal Saputra,2,"Udah premium tapi gabisa bikin akun dana bisnis, alasannya harus premium padahal udah hdeuh,",udah premium gabisa bikin akun dana bisnis alas premium udah hdeuh,netral
Jasman 2000,2,kenepa aplikasi dana tidak bisa menerima krist,kenepa aplikasi dana terima krist,netral
Wahib Zainul R 027,2,saya sangat puas dengan dana premium,puas dana premium,positif
Halimah Sakdiah,2,bgus,bgus,netral
Maria . Ch Leasa,2,"kok saldo saya gak masuk yaa , padahal sudah di top up ke dana",saldo masuk yaa top up dana,positif
Setiaputra Sony,2,buruk sekali skrng sekrng.kadang keluar bgtu ajh bug,buruk skrng sekrng kadang bgtu ajh bug,negatif
Mhd Alfi,2,cara menghapus riwayat transaksi dana,hapus riwayat transaksi dana,netral
Muhamad Haidar Ali,2,saya gabisa login dana berhari hari dengan notifikasi jaringan tidak ada terus menerus ber hari hari padahal jaringan saya bagus,gabisa login dana hari notifikasi jaring terus ber jaring bagus,positif
Sua ti,2,ok,ok,netral
Dasna Dalle,2,bagaimana cara buka akun yg salah masuk kirim uang kita,buka akun salah masuk kirim uang,netral
Zul Zulia,2,"fitur dana cicil kocak, tagihan udah di lunasin, limit masih banyak, tp transaksi tidak dapat diproses terus!! 👎👎👎",fitur dana cicil kocak tagih udah lunasin limit transaksi proses,netral
Trio putra,2,sudah lama menggunakan apk dana. tpi justru tidak mendapatkan fitur yg terbaru sperti dana cicil misal..,apk dana tpi fitur baru sperti dana cicil,netral
Ade Banjarwangi,2,gimana cara login dana wajah dulu terus pin,gimana login dana wajah pin,netral
Novi Channel,2,"ko bisa , saya dana cicil tidak bisa dipakai tapi ada limit saldo nya aneh",ko dana cicil pakai limit saldo nya aneh,netral
koreng bau,2,"dana saya ilang karna transaksi otomatis gogle, tanpa sepengetahuan saya",dana ilang karna transaksi otomatis gogle tahu,netral
Olih Setiabudi,2,kenapa ya saya buka aplikasi dana mental keluar terus.,ya buka aplikasi dana mental,netral
people pleaser,2,"mau transfer kok harus premium dulu! males banget, padahal penggunanya asli gue, ribet tau mau transfer sesama pengguna dana, seharusnya ada alternatif lain, terus juga pake fitur smart pay buat transfer malah gabisa (scan QR dari galeri yang belum kadaluwarsa gagal-coba lagi) terus.",transfer premium males banget guna asli gue ribet tau transfer guna dana alternatif pake fitur smart pay transfer gabisa scan qr galeri kadaluwarsa gagal coba,negatif
isna Yansyah,2,aktifka n dana cicil gmn,aktifka n dana cicil gmn,netral
Indra 001,2,dana cicil tidak muncul,dana cicil muncul,netral
Mutiah Tartila,2,aneh tb² aja saldo kepotong,aneh tb aja saldo potong,netral
herman syah,2,Baik,,netral
Cep Irpan,2,dana cicilan nyah jelek padahal udah lunas semua anh,dana cicil nyah jelek udah lunas anh,negatif
Rahman 039,2,ko saya ega ada dana cicil nya,ko ega dana cicil nya,netral
Rosnawati Rosna,2,"ngak jelas,,saya sudah satu bulan ngak bisa melakukan transaksi,,buat laporan hampir tiap hari tapih juga tidak di perbaiki",ngak ngak transaksi lapor tapih baik,positif
Helmi Budiansyah,2,"di update apk malah makin lemot, jelek. aneh",update apk lot jelek aneh,negatif
Novaldhikyriawan Novaldhikyriawan,2,ga ada dana cicilnya,dana cicil,netral
Gu Dang,2,knp dana cicil saya tidak tersedia? kok bisa ya dana cicil saya tidak tersedia padahal disitu sudah jls limitnya 150 TPI gak bisa digunakan percuma,knp dana cicil sedia ya dana cicil sedia situ jls limit tpi,netral
Ahmad Fikri,2,"sudah 1 tahun lebih , pembayaran bagus gak naik2 dana cicil.. tetep 100 RB dr awal... payah!!",bayar bagus dana cicil tetep rb dr payah,positif
Ani Karnita,2,"makin kesini makin bad banget, masa top up di atas 100K dipotong 1K, top up lagi di waktu yg sama di bawah 100K kena potong lagi 1K,, bayangkan aja kalau top up sampai 10 kali sehari, lama-lama ku hapus juga nih aplikasi",kesini bad banget top up k potong k top up k kena potong k bayang aja top up kali hari ku hapus nih aplikasi,positif
Hani Humaera,2,punya saya tidak ada fitur dana cicil .ini sudah lama..dan saya selalu update..sangat mengecewakan,fitur dana cicil update kecewa,negatif
Minecraft,2,karena dana ketarik 18000,dana tarik,netral
Realme,2,kak dana saya kenapa belum ada dana cicil padahal saya sudah menggunakan dana ini selama 3tahun knp pesan saya tidak ada yang balas mana dana cicil nya,kak dana dana cicil dana knp pesan balas dana cicil nya,netral
Mus Lihin,2,ngadain dana cicil tapi gak bisa di pake gajelas,ngadain dana cicil pake gajelas,netral
baly cell,2,Jangan nyimpen uang disini beresiko. Adminnya hanya chat bot saja bingung komplain kemana coba,nyimpen uang resiko adminnya chat bot bingung komplain mana coba,netral
Yudi Fiqyu,2,tidak menemukan solusi d mn tanya Diana cs maupun calsenter .d tanya ini itu g ada jwbn cal senter ganguan. mending uinstal aja pindah k gopay.. JD g sehati banyak aupdet g ada solusi,temu solusi d mn ana cs calsenter d g jwbn cal senter ganguan mending uinstal aja pindah k gopay g sehat aupdet g solusi,netral
Noverius Andre,2,dana instan saya tidak muncul padahal sering transaksi sudah premium juga dan barcode QR tidak bisa dibuka,dana instan muncul transaksi premium barcode qr buka,netral
Gisel ajagin,2,DANA CICIL TIDAK TERSEDIA,dana cicil sedia,netral
Rst Roock,2,"saya kasih saran kalau mau nyimpen uang hde2 jangan pakai dana kalo ada masalah susah urusin nya Telpon cs ajh gak bisa langsung beres harus cht diana ,gak ada live cht ,situs judol aja ada live cht ini susah kalo mau beresin kebanyakan nunggu",kasih saran nyimpen uang hde pakai dana kalo susah urusin nya telpon cs ajh langsung beres cht ana live cht situs judol aja live cht susah kalo resin banyak nunggu,negatif
Tompel Pkp,2,aku sdikit kecewa dgn dana cicil Napa alasannya disaat pengajuan buat dana cicil punya aku ditolak alasannya perbanyak pakai dana pdahal stiap hari aku pakai aplikasi dana jdi Dmana letak kesalahannya makasih 🙏,sdikit kecewa dana cicil napa alas saat aju dana cicil tolak alas banyak pakai dana pdahal stiap pakai aplikasi dana jdi dmana letak salah makasih,negatif
Ade Ramdani,3,"aplikasi nya bagus tapi abis di update malah sering crash, lalu tiba tiba keluar sendiri",aplikasi nya bagus abis update crash,netral
Fitri Ikhtia Islami,3,"tidak bisa dana pinjam gmn, kirain semua penguna dana ternyata g semua harusnya semua penguna dana",dana pinjam gmn kirain penguna dana g penguna dana,netral
Dwi Citra,3,"saya meminta bantuan di fitur yang ada tapi ternyata tidak membantu, yang ditanyakan berulang ulang tapi tidak ada solusi",bantu fitur bantu ulang ulang solusi,netral
muhamad romi,3,admin saya ada kendala akun lama sudah 6 hilang.. jadi saya tidak bisa premium kan akun baru ini.. saya mau install aja ni karena tidak ada solusinya melalui chat live,admin kendala akun hilang premium akun install aja ni solusi chat live,netral
Ari Febriansyah,3,bagaiamana dengan masalah saya masa tidak ada jawaban sama sekali selama setahun,bagaiamana tahun,netral
Aqyla imuets,3,jujur..aku baru daftar tapi malah GK bisa trus kakkk udah lupa pin TPI wajahnya tetep GK bisa,jujur daftar trus kakkk udah lupa pin tpi wajah tetep,netral
Rangga Saputra,3,tidak bisa login padahal nmr sudah sama keluar trus,login nmr trus,netral
Hendra Ocha88,3,"Aplikasinya lumayan, kalau bisa upgrade limitnya...",aplikasi lumayan upgrade limit,netral
Andiat Reindaman,3,tolong munculin pitur dana cicil saya,tolong munculin pitur dana cicil,netral
Nurma Galis,3,dana instan saya kok gak ada yaa padahal udah apgeret premium,dana instan yaa udah apgeret premium,netral
andra dare,3,bagus tapi fitur dana cicil ngak masuk padal riwayat uang keluar-masuk juta an,bagus fitur dana cicil ngak masuk padal riwayat uang masuk juta an,positif
STR Memories,3,admin MAHAL!!!,admin mahal,netral
Lim Leam,3,tolong bug nya lebih cepat di betul kan karena jika ada keperluan mendadak pas ada bug gak bisa di pakai,tolong bug nya cepat perlu dadak pas bug pakai,negatif
Helmi Andria,3,Sering minta Upgrade,upgrade,netral
Jodohjaemin,3,"dana kenapa si makin kesini makin banyak bug nya, kayak setiap transaksi pasti ada bug nya capek ih sampe gajadi checkout lewat tiktok muak asli, tolong benerin ya bug nya tapi dibalik semua itu dana bagus kok terima kasih.",dana si kesini bug nya kayak transaksi bug nya capek ih sampe gajadi checkout tiktok muak asli tolong benerin ya bug nya balik dana bagus terima kasih,negatif
Oppo SeriesA18,3,lumayan lah tapi kesalahan nya lambat transaksi nya tolong di perbaiki adminya pls biar agak cepatlah transaksi nya dan lancar,lumayan salah nya lambat transaksi nya tolong baik adminya pls biar cepat transaksi nya lancar,positif
Redmi 9c,3,kenapa saya tidak bisa mengikuti program beta pada akun dana saya,ikut program beta akun dana,netral
anak amak,3,tolong biarkan saya pakai fitur dana cicil,tolong biar pakai fitur dana cicil,netral
Iyan Ardiansyah,3,punya saya gada fitur dana cicil nya padahal udah 4 tahun pemakaian dan sering transaksi juga,gada fitur dana cicil nya udah pakai transaksi,netral
Saiman14 pLAt R,3,sangat bagus dan membantu sekali pelayanan nya memuaskan,bagus bantu layan nya muas,positif
Aznas Pakez,3,kenapa setiap brli paket data diaplikasi dana kadang tidak masuk ke nomor.ini juga tadi beli paket data diaplikasi dana masuk tapi tidak bisa dipakai,brli paket data aplikasi dana kadang masuk nomor beli paket data aplikasi dana masuk pakai,netral
Vinsmoke Septian,3,"Dana Bisnis, uang masuk ga pernah muncul suara notifikasinya",dana bisnis uang masuk muncul suara notifikasi,netral
Deri Aldaz,3,kenapa saya tidak bisa beli emas pake dana cicil..pdhal sebelum y bisa ko skrng ga bisa?,beli emas pake dana cicil pdhal y ko skrng,netral
Lhapo Dhelok,3,Gk bisa2,,netral
Agus Haryanto,3,"pemindahan akun premium sulit dan bertele-tele, nomor lama kartunya hilang, aku ajukan nomor baru,... selama ktp, vermuk, dan keterangan benar, seharusnya mudah, gampang, simpel. males banget klo berurusan sama bot gak guna",pindah akun premium sulit tele tele nomor kartu hilang aju nomor ktp vermuk terang mudah gampang simpel males banget klo urus bot,netral
Dadan Herdiansyah,3,dacilnya ga menyeluruh yg dapet dapet yg ngak nggak kan orang pake dana trus klu emang ga bayar. pas isi saldo langsung aja potong gampang kan,dacilnya dapet dapet ngak orang pake dana trus klu emang bayar pas isi saldo langsung aja potong gampang,netral
arga Muhammad anshor,3,aku daftar bisnis tapi ga bisa kirim pendaftaranya kecewaaaa,daftar bisnis kirim pendaftaranya kecewaaaa,netral
Rina Ruyani,3,Maaf y knpa saya gk bsa login lagi tolong bantuan nya 🙏,maaf y knpa bsa login tolong bantu nya,netral
Selsa Balqis,3,"dana nya error,dan malah menolak pembayaran,percuma udah di isi tapi malah gak bisa di bake bayar,itu salah satu masalah ku yang paling membuat kesal",dana nya error tolak bayar udah isi bake bayar salah ku kesal,negatif
Rosalia Maharani,3,kakkk ini gimana yaa cara ubah nama bisnis nya???,kakkk gimana yaa ubah nama bisnis nya,netral
Clarissa Ayu,3,kenapa sekarang kalo ada tf an masuk notif ga langsung keluar/ ga langsung ada notif tf masuk??? tf masuk jm 7 pagi tp notif masuk jm 9 mlm.. tlong di perbaiki ya pdahal aku udah pake dana udah lama baru ini kenapa gitu?? kan jadi nya aku gatau ada tf masuk apa engga.. masa harus buka aplikasi dulu,kalo tf an masuk notif langsung langsung notif tf masuk tf masuk jm pagi notif masuk jm mlm tlong baik ya pdahal udah pake dana udah gitu nya gatau tf masuk engga buka aplikasi,positif
Sunemi Dapan,3,"kenapa aplikasi ini tidak berfungsi dengan baik di Oppo a95,, log in saja dapet nya kamera belakang trus hitam putih lagi,,, adakah penjelasan",aplikasi fungsi oppo a log in dapet nya kamera trus hitam putih ada jelas,netral
Sonny ari irawan,3,"harusnya tiap buka aplikasi difasilitasi kunci keamanan,mirip mbanking,jadi tiap mau masuk diminta masukan paskeynya",buka aplikasi fasilitas kunci aman mbanking masuk masuk paskeynya,positif
Anisa Rahmafitri,3,aneehh ... bisa2 nya saldo 241 ribu transaksi 30 ribu lewat qriss saldo sisa 181 ribu .. koq bisa transaksi ku jadi ganda,aneehh nya saldo ribu transaksi ribu qriss saldo sisa ribu koq transaksi ku ganda,netral
Puji Lestari,3,"aplikasinya bagus, cuma saran aja klo bisa di DANA BISNIS sediakan fitur notifikasi suara pembayaran Qris bersuara nominal uangnya biar kalau ada transaksi tidak ngecekin layar hp terus,sementara bintang 3 dulu nanti kalau ada perbaikan bintang 5",aplikasi bagus saran aja klo dana bisnis sedia fitur notifikasi suara bayar qris suara nominal uang biar transaksi ngecekin layar hp bintang baik bintang,positif
Marlina Marlina,3,memuas kan,muas,netral
DAVIN AL FACHTAN,3,"dana bisnisnya suka eror, QR gua kaga bisa di TF woii",dana bisnis suka eror qr gua kaga tf woii,netral
Anjas Pratama,3,maaf saya kurangi karna dana cicil saya ga bisa di aktivasi,maaf kurang karna dana cicil aktivasi,netral
Made Agusdwi,3,TOLONG AKTIFKAN FITUR DANA INSTAN DI AKUN KUU,tolong aktif fitur dana instan akun kuu,netral
Riska Ratna Dewi,3,"Masa tiap isi saldo kepotong 1.500 dulu cuma 500, klo kepotong sehari sekali masih mending atau dibatasin sebulan gratis adm brp kali kaya transfer",isi saldo potong klo potong hari mending dibatasin bulan gratis adm brp kali kaya transfer,netral
Rani Rani,3,sangat membantu,bantu,netral
Zoro Night,3,isi pulsa gak masuk masuk aneh,isi pulsa masuk masuk aneh,netral
iwan purnomo,3,ok,ok,netral
Wahyu Tirto,3,ok,ok,netral
Sakura,3,cepat,cepat,positif
Surya Danny,3,apa dana lagi error akun saya tidak bisa terbuka,dana error akun buka,negatif
Hilman Mahpud,3,Ini saya kenapa gak bisa kirim uang hadehh,kirim uang hadehh,netral
ayu lestary,3,dana saya kenapa gabisa pakai data seluler ya harus slalu pakai wifi atau hospot,dana gabisa pakai data seluler ya slalu pakai wifi hospot,netral
Wahyu Inayah,3,sekarang tarik tunai di Alfamart atau Alfamidi ada biaya admin nya 3rb besar kali admin nya dulu gk ada admin nya sekarang ada tolong di perbarui lagi ya dana biar konsumen nya semua sama sama enak kalau untuk transaksi lainya menurutku oke lah,tarik tunai alfamart alfamidi biaya admin nya rb kali admin nya admin nya tolong baru ya dana biar konsumen nya enak transaksi lai turut oke,positif
Pebri Arrobani,3,Selalu sering gangguan,ganggu,netral
Nifri Gincai,3,kenapa dana cicil saya tidak ada,dana cicil,netral
Nayasa 1302,3,gmpng digunain cepet ngirim cuma kadang suka lemot buat transaksi,gmpng digunain cepet ngirim kadang suka lot transaksi,netral
enung rosmanah,3,mantap betul nih,mantap nih,positif
Ready 86,3,"kenapa diaplikasi dana saya gak ada bang btn? sehingga saya gak bisa melakukan transfer kesana. padahal, bang lain semua ada. cuma bang btn yang gak muncul dimenu.",aplikasi dana bang btn transfer kesana bang bang btn muncul menu,netral
Asuii78 Ayangg78,3,bagus,bagus,positif
Berdy_ ??,3,aplikasi nya oke sih cuma kadang-kadang aplikasi suka ngelag saya sering bayar ganda lagi gak 1x - 2x doang tapi sering. tolong pihak dev dana perbaiki dong,aplikasi nya oke sih kadang kadang aplikasi suka ngelag bayar ganda x x doang tolong dev dana baik,positif
Muslim Syaputra,3,puasss Skali pakai dana gak ribettt,puasss skali pakai dana ribettt,netral
